title,abstract
hardware trojan dataset of risc-v and web3 generated with chatgpt-4,"Although hardware trojans impose a relevant threat to the hardware security of RISC-V and Web3 applications, existing datasets have a limited set of examples, as the most famous hardware trojan dataset TrustHub has 106 different trojans. RISC-V specifically has study cases of three and four different hardware trojans, and no research was found regarding Web3 hardware trojans in modules such as a hardware wallet. This research presents a dataset of 290 Verilog examples generated with ChatGPT-4 Large Language Model (LLM) based on 29 golden models and the TrustHub taxonomy. It is expected that this dataset supports future research endeavors regarding defense mechanisms against hardware trojans in RISC-V, hardware wallet, and hardware Proof of Work (PoW) miner."
"comprehensive dataset on pre-sars-cov-2 infection sports-related physical activity levels, disease severity, and treatment outcomes: insights and implications for covid-19 management","This dataset aimed to explore associations between pre-SARS-CoV-2 infection exercise and sports-related physical activity (PA) levels and disease severity, along with treatments administered following the most recent SARS-CoV-2 infection. A comprehensive analysis investigated the relationships between PA categories (“Inactive”, “Low PA”, “Moderate PA”, “High PA”), disease severity (“Sporadic”, “Episodic”, “Recurrent”, “Frequent”, “Persistent”), and treatments post-SARS-CoV-2 infection (“No treatment”, “Home remedies”, “Prescribed medication”, “Hospital admission”, “Intensive care unit admission”) within a sample population (n = 5829) from the Hellenic territory. Utilizing the Active-Q questionnaire, data were collected from February to March 2023, capturing PA habits, participant characteristics, medical history, vaccination status, and illness experiences. Findings revealed an independent relationship between preinfection PA levels and disease severity (χ2 = 9.097, df = 12, p = 0.695). Additionally, a statistical dependency emerged between PA levels and illness treatment categories (χ2 = 39.362, df = 12, p < 0.001), particularly linking inactive PA with home remedies treatment. These results highlight the potential influence of preinfection PA on disease severity and treatment choices following SARS-CoV-2 infection. The dataset offers valuable insights into the interplay between PA, disease outcomes, and treatment decisions, aiding future research in shaping targeted interventions and public health strategies related to COVID-19 management."
a dataset for studying the relationship between human and smart devices,"This dataset reports the responses to a survey designed for investigating the relationship that humans have with their smart devices. The dataset was collected between May and July 2020 and is a sample of over 500 respondents of various ethnicities and backgrounds. These data were used for modeling the ways that people relate to their devices using the notion of agency. However, the data can be used for complementing any study that intends to investigate a tool-mediated communication from the perspective of users, applying a variety of beliefs, attitudes, and expectations that users have in relation to their devices and themselves. This article presents the survey items as well as some preliminary data insights. The collected data were in English and the responses were anonymized to ensure GDPR compliance. The data were stored in a .csv file containing the respondents’ answers to the questions."
genomic epidemiology dataset for the important nosocomial pathogenic bacterium acinetobacter baumannii,"The infections caused by various bacterial pathogens both in clinical and community settings represent a significant threat to public healthcare worldwide. The growing resistance to antimicrobial drugs acquired by bacterial species causing healthcare-associated infections has already become a life-threatening danger noticed by the World Health Organization. Several groups or lineages of bacterial isolates, usually called ‘the clones of high risk’, often drive the spread of resistance within particular species. Thus, it is vitally important to reveal and track the spread of such clones and the mechanisms by which they acquire antibiotic resistance and enhance their survival skills. Currently, the analysis of whole-genome sequences for bacterial isolates of interest is increasingly used for these purposes, including epidemiological surveillance and the development of spread prevention measures. However, the availability and uniformity of the data derived from genomic sequences often represent a bottleneck for such investigations. With this dataset, we present the results of a genomic epidemiology analysis of 17,546 genomes of a dangerous bacterial pathogen, Acinetobacter baumannii. Important typing information, including multilocus sequence typing (MLST)-based sequence types (STs), intrinsic blaOXA-51-like gene variants, capsular (KL) and oligosaccharide (OCL) types, CRISPR-Cas systems, and cgMLST profiles are presented, as well as the assignment of particular isolates to nine known international clones of high risk. The presence of antimicrobial resistance genes within the genomes is also reported. These data will be useful for researchers in the field of A. baumannii genomic epidemiology, resistance analysis, and prevention measure development."
subjective well-being and mental health among college students: two datasets for diagnosis and program evaluation,"This paper presents two datasets about college students’ subjective well-being and mental health in a developing country. The first data set of this report offers a diagnosis of the prevalence of self-reported symptoms associated with stress, anxiety, depression, and overall evaluation of subjective well-being. The study uses validated scales to measure self-reported symptoms related to mental health conditions. To measure stress, the study used the Perceived Stress Scale (PSS-10) and the 7-item Generalized Anxiety Disorder Scale (GAD-7) to measure symptoms associated with anxiety (GAD-7), and the 9-item Patient Health Questionnaire (PHQ-9) to measure symptoms associated with depression. This diagnosis was collected in a college student sample of 3052 undergrad students in 2022 at a medium-sized university in Colombia. The second dataset reports the evaluation of a positive education intervention implemented in the same university. The Colombian Minister of Science and Technology financed the intervention to promote strategies to mitigate the consequences on college students’ well-being and mental health after the pandemic. The program evaluation data cover two years (2020–2022) with 193 college students in the treatment group (students enrolled in a class teaching evidence-based interventions to promote well-being and mental health awareness) and 135 students in the control group. Data for evaluation include a broad array of variables of life satisfaction, happiness, negative emotions, COVID-19 effects, relationships valuations, and habits and the measurement of three scales: The Satisfaction with Life Scale (SWLS), a brief measurement of depressive symptomatology (CESD-7), and the Brief Strengths Scale (BSS)."
wearable device bluetooth/ble physical layer dataset,"Wearable devices, such as headsets and activity trackers, rely heavily on the Bluetooth and/or the Bluetooth Low Energy wireless communication standard to exchange data with smartphones or other peripherals. Since these devices collect personal health and activity data, ensuring the privacy and security of the transmitted data is crucial. Therefore, we present a dataset that captures complete Bluetooth communications—including advertising, connection, data exchange, and disconnection—in an RF isolated environment using software-defined radio. We were able to successfully decode the captured Bluetooth packets using existing tools. This dataset provides researchers with the ability to fully analyze Bluetooth traffic and gain insight into communication patterns and potential security vulnerabilities."
de-anonymizing users across rating datasets via record linkage and quasi-identifier attacks,"The widespread availability of pseudonymized user datasets has enabled personalized recommendation systems. However, recent studies have shown that users can be de-anonymized by exploiting the uniqueness of their data patterns, raising significant privacy concerns. This paper presents a novel approach that tackles the challenging task of linking user identities across multiple rating datasets from diverse domains, such as movies, books, and music, by leveraging the consistency of users’ rating patterns as high-dimensional quasi-identifiers. The proposed method combines probabilistic record linkage techniques with quasi-identifier attacks, employing the Fellegi–Sunter model to compute the likelihood of two records referring to the same user based on the similarity of their rating vectors. Through extensive experiments on three publicly available rating datasets, we demonstrate the effectiveness of the proposed approach in achieving high precision and recall in cross-dataset de-anonymization tasks, outperforming existing techniques, with F1-scores ranging from 0.72 to 0.79 for pairwise de-anonymization tasks. The novelty of this research lies in the unique integration of record linkage techniques with quasi-identifier attacks, enabling the effective exploitation of the uniqueness of rating patterns as high-dimensional quasi-identifiers to link user identities across diverse datasets, addressing a limitation of existing methodologies. We thoroughly investigate the impact of various factors, including similarity metrics, dataset combinations, data sparsity, and user demographics, on the de-anonymization performance. This work highlights the potential privacy risks associated with the release of anonymized user data across diverse contexts and underscores the critical need for stronger anonymization techniques and tailored privacy-preserving mechanisms for rating datasets and recommender systems."
"the yinshan mountains record over 10, 000 landslides","China boasts a vast expanse of mountainous terrain, characterized by intricate geological conditions and structural features, resulting in frequent geological disasters. Among these, landslides, as prototypical geological hazards, pose significant threats to both lives and property. Consequently, conducting a comprehensive landslide inventory in mountainous regions is imperative for current research. This study concentrates on the Yinshan Mountains, an ancient fault-block mountain range spanning east–west in the central Inner Mongolia Autonomous Region, extending from Langshan Mountains in the west to Damaqun Mountains in the east, with the narrow sense Xiao–Yin Mountains District in between. Employing multi-temporal high-resolution remote sensing images from Google Earth, this study conducted visual interpretation, identifying 10,968 landslides in the Yinshan area, encompassing a total area of 308.94 km2. The largest landslide occupies 2.95 km2, while the smallest covers 84.47 m2. Specifically, the Langshan area comprises 331 landslides with a total area of 11.96 km2, the narrow sense Xiao–Yin Mountains include 3393 landslides covering 64.13 km2, and the Manhan Mountains, Damaqun Mountains, and adjacent areas account for 7244 landslides over a total area of 232.85 km2. This research not only contributes to global landslide cataloging initiatives but also serves as a robust foundation for future geohazard prevention and management efforts."
a series production data set for five-axis cnc milling,"The described data set contains features from the machine control of a five-axis milling machine. The features were recorded during thirteen series productions. Each series production includes a changeover process in which the machine was set up for the production of a different product. In addition to the timestamps and the twenty recorded features derived from Numerical Control (NC) variables, the data set also contains labels for the different production phases. For this purpose, up to 23 phases were assigned, which are based on a generalized milling process. The data set consists of thirteen .csv files, each representing a series production. The data set was recorded in a production company in the contract manufacturing sector for components with real series orders in ongoing industrial production."
draft genome sequencing of the bacillus thuringiensis var. thuringiensis highly insecticidal strain 800/15,"The Bacillus thuringiensis serovar thuringiensis strain 800/15 has been actively used as an agent in biopreparations with high insecticidal activity against the larvae of the Colorado potato beetle Leptinotarsa decemlineata and gypsy moth Lymantria dispar. In the current study, we present the first draft genome of the 800/15 strain coupled with a comparative genomic analysis of its closest reference strains. The raw sequence data were obtained by Illumina technology on the HiSeq X platform and de novo assembled with the SPAdes v3.15.4 software. The genome reached 6,524,663 bp. in size and carried 6771 coding sequences, 3 of which represented loci encoding insecticidal toxins, namely, Spp1Aa1, Cry1Ab9, and Cry1Ba8 active against the orders Lepidoptera, Blattodea, Hemiptera, Diptera, and Coleoptera. We also revealed the biosynthetic gene clusters responsible for the synthesis of secondary metabolites, including fengycin, bacillibactin, and petrobactin with predicted antibacterial, fungicidal, and growth-promoting properties. Further comparative genomics suggested the strain is not enriched with genes linked with biological activities implying that agriculturally important properties rely more on the composition of loci rather than their abundance. The obtained genomic sequence of the strain with the experimental metadata could facilitate the computational prediction of bacterial isolates’ potency from genomic data."
multimodal hinglish tweet dataset for deep pragmatic analysis,"Wars, conflicts, and peace efforts have become inherent characteristics of regions, and understanding the prevailing sentiments related to these issues is crucial for finding long-lasting solutions. Twitter/`X’, with its vast user base and real-time nature, provides a valuable source to assess the raw emotions and opinions of people regarding war, conflict, and peace. This paper focuses on collecting and curating hinglish tweets specifically related to wars, conflicts, and associated taxonomy. The creation of said dataset addresses the existing gap in contemporary literature, which lacks comprehensive datasets capturing the emotions and sentiments expressed by individuals regarding wars, conflicts, and peace efforts. This dataset holds significant value and application in deep pragmatic analysis as it enables future researchers to identify the flow of sentiments, analyze the information architecture surrounding war, conflict, and peace effects, and delve into the associated psychology in this context. To ensure the dataset’s quality and relevance, a meticulous selection process was employed, resulting in the inclusion of explanable 500 carefully chosen search filters. The dataset currently has 10,040 tweets that have been validated with the help of human expert to make sure they are correct and accurate."
proteomic and metabolomic analyses of the blood samples of highly trained athletes,"High exercise loading causes intricate and ambiguous proteomic and metabolic changes. This study aims to describe the dataset on protein and metabolite contents in plasma samples collected from highly trained athletes across different sports disciplines. The proteomic and metabolomic analyses of the plasma samples of highly trained athletes engaged in sports disciplines of different intensities were carried out using HPLC-MS/MS. The results are reported as two datasets (proteomic data in a derived mgf-file and metabolomic data in processed format), each containing the findings obtained by analyzing 93 mass spectra. Variations in the protein and metabolite contents of the biological samples are observed, depending on the intensity of training load for different sports disciplines. Mass spectrometric proteomic and metabolomic studies can be used for classifying different athlete phenotypes according to the intensity of sports discipline and for the assessment of the efficiency of the recovery period."
digital elevation models and orthomosaics of the dutch noordwest natuurkern foredune restoration project,"Coastal dunes worldwide are increasingly under pressure from the adverse effects of human activities. Therefore, more and more restoration measures are being taken to create conditions that help disturbed coastal dune ecosystems regenerate or recover naturally. However, many projects lack the (open-access) monitoring observations needed to signal whether further actions are needed, and hence lack the opportunity to  learn by doing . This submission presents an open-access data set of 37 high-resolution digital elevation models and 24 orthomosaics collected before and after the excavation of five artificial foredune trough blowouts (“notches”) in winter 2012/2013 in the Dutch Zuid-Kennemerland National Park, one of the largest coastal dune restoration projects in northwest Europe. These high-resolution data provide a valuable resource for improving understanding of the biogeomorphic processes that determine the evolution of restored dune systems as well as developing guidelines to better design future restoration efforts with foredune notching."
analysis of a bluetooth traffic dataset obtained during university examination sessions,"In academic environments, students take exams simultaneously in campus examination classrooms. Due to recent advancements in technology, examination rooms are flooded with Bluetooth data traffic generated by personal devices (smartphones, smartwatches, etc.). The work presented in this article proposes a method for collecting Bluetooth traffic in an academic examination setting. The desired data were collected during several examination sessions using an Ubertooth One device, and then an in-depth post-processing analysis was performed on the collected dataset. The devices generating traffic were precisely located within the examination room, and areas with heightened data traffic were highlighted. Additionally, another goal of the current research was to provide a unique type of dataset to the academic community, facilitating its utilization in further research endeavors."
gemsyd: generic framework for synthetic data generation,"In the era of data-driven technologies, the need for diverse and high-quality datasets for training and testing machine learning models has become increasingly critical. In this article, we present a versatile methodology, the Generic Methodology for Constructing Synthetic Data Generation (GeMSyD), which addresses the challenge of synthetic data creation in the context of smart devices. GeMSyD provides a framework that enables the generation of synthetic datasets, aligning them closely with real-world data. To demonstrate the utility of GeMSyD, we instantiate the methodology by constructing a synthetic data generation framework tailored to the domain of event-based data modeling, specifically focusing on user interactions with smart devices. Our framework leverages GeMSyD to create synthetic datasets that faithfully emulate the dynamics of human–device interactions, including the temporal dependencies. Furthermore, we showcase how the synthetic data generated using our framework can serve as a valuable resource for machine learning practitioners. By employing these synthetic datasets, we perform a series of experiments to evaluate the performance of a neural-network-based prediction model in the domain of smart device interaction. Our results underscore the potential of synthetic data in facilitating model development and benchmarking."
unveiling university groupings: a clustering analysis for academic rankings,"The evaluation and ranking of educational institutions are of paramount importance to a wide range of stakeholders, including students, faculty members, funding organizations, and the institutions themselves. Traditional ranking systems, such as those provided by QS, ARWU, and THE, have offered valuable insights into university performance by employing a variety of indicators to reflect institutional excellence across research, teaching, international outlook, and more. However, these linear rankings may not fully capture the multifaceted nature of university performance. This study introduces a novel clustering analysis that complements existing rankings by grouping universities with similar characteristics, providing a multidimensional perspective on global higher education landscapes. Utilizing a range of clustering algorithms—K-Means, GMM, Agglomerative, and Fuzzy C-Means—and incorporating both traditional and unique indicators, our approach seeks to highlight the commonalities and shared strengths within clusters of universities. This analysis does not aim to supplant existing ranking systems but to augment them by offering stakeholders an alternative lens through which to view and assess university performance. By focusing on group similarities rather than ordinal positions, our method encourages a more nuanced understanding of institutional excellence and facilitates peer learning among universities with similar profiles. While acknowledging the limitations inherent in any methodological approach, including the selection of indicators and clustering algorithms, this study underscores the value of complementary analyses in enriching our understanding of higher educational institutions’ performance."
a set of ground penetrating radar measures from quarries,"This paper presents a set of Ground Penetrating Radar (GPR) data obtained from in situ measurements conducted in four ornamental stone quarries located in Italy (Botticino quarry) and Romania (Ruschita, Carpinis, and Pietroasa quarries). The GPR is a Non-Destructive Testing (NDT) technique that enables the detection and localization of fractures without damage to the surface, among other capabilities. In this study, two instruments of ground-coupled GPR were used to detect and locate the fractures, discontinuities, or weakened zones. The GPR data contains radargrams for discontinuities and fracture detection, besides the geographic location of the measures. For each measurement site, a set of radargrams has been acquired in two orthogonal directions, allowing for a 3D reconstruction of the investigated site."
in vivo and in vitro electrochemical impedance spectroscopy of acute and chronic intracranial electrodes,"Invasive intracranial electrodes are used in both clinical and research applications for recording and stimulation of brain tissue, providing essential data in acute and chronic contexts. The impedance characteristics of the electrode–tissue interface (ETI) evolve over time and can change dramatically relative to pre-implantation baseline. Understanding how ETI properties contribute to the recording and stimulation characteristics of an electrode can provide valuable insights for users who often do not have access to complex impedance characterizations of their devices. In contrast to the typical method of characterizing electrical impedance at a single frequency, we demonstrate a method for using electrochemical impedance spectroscopy (EIS) to investigate complex characteristics of the ETI of several commonly used acute and chronic electrodes. We also describe precise modeling strategies for verifying the accuracy of our instrumentation and understanding device–solution interactions, both in vivo and in vitro. Included with this publication is a dataset containing both in vitro and in vivo device characterizations, as well as some examples of modeling and error structure analysis results. These data can be used for more detailed interpretation of neural recordings performed on common electrode types, providing a more complete picture of their properties than is often available to users."
mapping of data-sharing repositories for paediatric clinical research - a rapid review,"The reuse of paediatric individual patient data (IPD) from clinical trials (CTs) is essential to overcome specific ethical, regulatory, methodological, and economic issues that hinder the progress of paediatric research. Sharing data through repositories enables the aggregation and dissemination of clinical information, fosters collaboration between researchers, and promotes transparency. This work aims to identify and describe existing data-sharing repositories (DSRs) developed to store, share, and reuse paediatric IPD from CTs. A rapid review of platforms providing access to electronic DSRs was conducted. A two-stage process was used to characterize DSRs: a first step of identification, followed by a second step of analysis using a set of eight purpose-built indicators. From an initial set of forty-five publicly available DSRs, twenty-one DSRs were identified as meeting the eligibility criteria. Only two DSRs were found to be totally focused on the paediatric population. Despite an increased awareness of the importance of data sharing, the results of this study show that paediatrics remains an area in which targeted efforts are still needed. Promoting initiatives to raise awareness of these DSRs and creating ad hoc measures and common standards for the sharing of paediatric CT data could help to bridge this gap in paediatric research."
