title,abstract
an optimized hybrid approach for feature selection based on chi-square and particle swarm optimization algorithms,"Feature selection is a significant issue in the machine learning process. Most datasets include features that are not needed for the problem being studied. These irrelevant features reduce both the efficiency and accuracy of the algorithm. It is possible to think about feature selection as an optimization problem. Swarm intelligence algorithms are promising techniques for solving this problem. This research paper presents a hybrid approach for tackling the problem of feature selection. A filter method (chi-square) and two wrapper swarm intelligence algorithms (grey wolf optimization (GWO) and particle swarm optimization (PSO)) are used in two different techniques to improve feature selection accuracy and system execution time. The performance of the two phases of the proposed approach is assessed using two distinct datasets. The results show that PSOGWO yields a maximum accuracy boost of 95.3%, while chi2-PSOGWO yields a maximum accuracy improvement of 95.961% for feature selection. The experimental results show that the proposed approach performs better than the compared approaches."
"gender distribution of scientific prizes is associated with naming of awards after men, women or neutral","Woman scientists have for long been under-represented as recipients of academic prizes. The reasons for this lack of recognition are manifold, including potential gender bias amongst award panels and nomination practices. This dataset of the gender distribution of 8747 recipients of 345 scientific medals and prizes awarded by 11 General Scientific Societies as well as subject-specific societies in the Earth and Environmental Sciences and in Cardiology between 1731 and 2021 explores the magnitude, temporal trends and potential drivers of observed gender imbalances. Our analysis revealed women were particularly underrepresented in awards named after men with awards not named after a person or named after a woman being more frequently awarded to woman scientists. Time-series analysis confirmed persisting trends that are only starting to change since the early 2000s, indicating that a lot remains to be accomplished to achieve true equity. We encourage the scientific community to extend our data and analysis, as they represent important evidence of the recognition of academic achievements towards other under-represented groups and including also nomination information."
stimulated microcontroller dataset for new iot device identification schemes through on-chip sensor monitoring,"Legitimate identification of devices is crucial to ensure the security of present and future IoT ecosystems. In this regard, AI-based systems that exploit intrinsic hardware variations have gained notable relevance. Within this context, on-chip sensors included for monitoring purposes in a wide range of SoCs remain almost unexplored, despite their potential as a valuable source of both information and variability. In this work, we introduce and release a dataset comprising data collected from the on-chip temperature and voltage sensors of 20 microcontroller-based boards from the STM32L family. These boards were stimulated with five different algorithms, as workloads to elicit diverse responses. The dataset consists of five acquisitions (1.3 billion readouts) that are spaced over time and were obtained under different configurations using an automated platform. The raw dataset is publicly available, along with metadata and scripts developed to generate pre-processed T–V sequence sets. Finally, a proof of concept consisting of training a simple model is presented to demonstrate the feasibility of the identification system based on these data."
"wea-acceptance data - a dataset of acoustic, meteorological, and operational wind turbine measurements","In this article, a dataset is described which combines wind turbine supervisory control and data acquisition (SCADA), meteorological and acoustical data and thus gives a detailed description of a wind farm and its atmospheric and acoustic environment. The data were collected during different seasons for several weeks at a time, such that a multitude of environmental and operational conditions are covered. In five measurement campaigns, in total three different locations with similar surroundings were captured. The raw data were enhanced with derived values such as atmospheric stability or direction of sound propagation. Data of one month including all time series measurements as well as monophonic audio recordings are now published. The dataset also contains three exemplary use cases along with documents that describe the data pre-processing."
conflicting marks archive dataset: a dataset of conflicting marks from the brazilian intellectual property office,"A registered trademark represents one of a company’s most valuable intellectual assets, acting as a safeguard against possible reputational damage and financial losses resulting from infringements of this intellectual property. To be registered, a mark must be unique and distinctive in relation to other trademarks which are already registered. In this paper, we describe the CMAD, an acronym for Conflicting Marks Archive Dataset. This dataset has been meticulously organized into pairs of marks (Number of pairs = 18,355) involved in copyright infringement across word, figurative and mixed marks. Organizations sought to register these marks with the National Institute of Industrial Property (INPI) in Brazil, and had their applications denied after analysis by intellectual property specialists. The robustness of this dataset is ensured by the intrinsic similarity of the conflicting marks, since the decisions were made by INPI specialists. This characteristic provides a reliable basis for the development and testing of tools designed to analyze similarity between marks, thus contributing to the evolution of practices and computer-based solutions in the field of intellectual property."
neural architecture comparison for bibliographic reference segmentation: an empirical study,"In the realm of digital libraries, efficiently managing and accessing scientific publications necessitates automated bibliographic reference segmentation. This study addresses the challenge of accurately segmenting bibliographic references, a task complicated by the varied formats and styles of references. Focusing on the empirical evaluation of Conditional Random Fields (CRF), Bidirectional Long Short-Term Memory with CRF (BiLSTM + CRF), and Transformer Encoder with CRF (Transformer + CRF) architectures, this research employs Byte Pair Encoding and Character Embeddings for vector representation. The models underwent training on the extensive Giant corpus and subsequent evaluation on the Cora Corpus to ensure a balanced and rigorous comparison, maintaining uniformity across embedding layers, normalization techniques, and Dropout strategies. Results indicate that the BiLSTM + CRF architecture outperforms its counterparts by adeptly handling the syntactic structures prevalent in bibliographic data, achieving an F1-Score of 0.96. This outcome highlights the necessity of aligning model architecture with the specific syntactic demands of bibliographic reference segmentation tasks. Consequently, the study establishes the BiLSTM + CRF model as a superior approach within the current state-of-the-art, offering a robust solution for the challenges faced in digital library management and scholarly communication."
an eeg dataset of subject pairs during collaboration and competition tasks in face-to-face and online modalities,"This dataset was acquired during collaboration and competition tasks performed by sixteen subject pairs (N = 32) of one female and one male under different (face-to-face and online) modalities. The collaborative task corresponds to cooperating to put together a 100-piece puzzle, while the competition task refers to playing against each other in a one-on-one classic 28-piece dominoes game. In the face-to-face modality, all interactions between the pair occurred in person. On the other hand, in the online modality, participants were physically separated, and interaction was only allowed through Zoom software with an active microphone and camera. Electroencephalography data of the two subjects were acquired simultaneously while performing the tasks. This article describes the experimental setup, the process of the data streams acquired during the tasks, and the assessment of data quality."
the china historical christian database: a dataset quantifying christianity in china from 1550 to 1950,"The era of digitization is revolutionizing traditional humanities research, presenting both novel methodologies and challenges. This field harnesses quantitative techniques to yield groundbreaking insights, contingent upon comprehensive datasets on historical subjects. The China Historical Christian Database (CHCD) exemplifies this trend, furnishing researchers with a rich repository of historical, relational, and geographical data about Christianity in China from 1550 to 1950. The study of Christianity in China confronts formidable obstacles, including the mobility of historical agents, fluctuating relational networks, and linguistic disparities among scattered sources. The CHCD addresses these challenges by curating an open-access database built in neo4j that records information about Christian institutions in China and those that worked inside of them. Drawing on historical sources, the CHCD contains temporal, relational, and geographic data. The database currently has over 40,000 nodes and 200,000 relationships, and continues to grow. Beyond its utility for religious studies, the CHCD encompasses broader interdisciplinary inquiries including social network analysis, geospatial visualization, and economic modeling. This article introduces the CHCD’s structure, and explains the data collection and curation process."
a comprehensive dataset of the aerodynamic and geometric coefficients of airfoils in the public domain,"This study presents an extensive collection of data on the aerodynamic behavior at a low Reynolds number and geometric coefficients for 2900 airfoils obtained through the class shape transformation (CST) method. By employing a verified OpenFOAM-based CFD simulation framework, lift and drag coefficients were determined at a Reynolds number of 105. Considering the limited availability of data on low Reynolds number airfoils, this dataset is invaluable for a wide range of applications, including unmanned aerial vehicles (UAVs) and wind turbines. Additionally, the study offers a method for automating CFD simulations that could be applied to obtain aerodynamic coefficients at higher Reynolds numbers. The breadth of this dataset also supports the enhancement and creation of machine learning (ML) models, further advancing research into the aerodynamics of airfoils and lifting surfaces."
data on stark broadening of n vi spectral lines,"Data on Stark broadening parameters, spectral line widths, and shifts for 15 multiplets of N VI, whose spectral lines are broadened by collisions with electrons, protons, alpha particles (He III) and B III, B IV, B V and B VI ions, are presented. They have been calculated using the semiclassical perturbation theory, for temperatures from 50,000 K to 2,000,000 K, and perturber densities from 1016 cm−3 up to 1024 cm−3. The data for e, p and He III are of particular interest for the analysis and modelling of atmospheres of hot and dense stars, as, e.g., white dwarfs, and for investigation of their spectra, and data for boron ions are used for analysis and modelling of laser-driven plasma in proton–boron fusion research."
mhair: a dataset of audio-image representations for multimodal human actions,"Audio-image representations for a multimodal human action (MHAiR) dataset contains six different image representations of the audio signals that capture the temporal dynamics of the actions in a very compact and informative way. The dataset was extracted from the audio recordings which were captured from an existing video dataset, i.e., UCF101. Each data sample captured a duration of approximately 10 s long, and the overall dataset was split into 4893 training samples and 1944 testing samples. The resulting feature sequences were then converted into images, which can be used for human action recognition and other related tasks. These images can be used as a benchmark dataset for evaluating the performance of machine learning models for human action recognition and related tasks. These audio-image representations could be suitable for a wide range of applications, such as surveillance, healthcare monitoring, and robotics. The dataset can also be used for transfer learning, where pre-trained models can be fine-tuned on a specific task using specific audio images. Thus, this dataset can facilitate the development of new techniques and approaches for improving the accuracy of human action-related tasks and also serve as a standard benchmark for testing the performance of different machine learning models and algorithms."
tuning data mining models to predict secondary school academic performance,"In recent years, educational data mining has emerged as a growing discipline focused on developing models for predicting academic performance. The primary objective of this research was to tune classification models to predict academic performance in secondary school. The dataset employed for this study encompassed information from 19,545 high school students. We used descriptive statistics to characterise information contained in personal, school, and socioeconomic variables. We implemented two data mining techniques, namely artificial neural networks (ANN) and support vector machines (SVM). Parameter optimisation was conducted through five–fold cross–validation, and model performance was assessed using accuracy and F1–Score. The results indicate a functional dependence between predictor variables and academic performance. The algorithms demonstrated an average performance exceeding 80% accuracy. Notably, ANN outperformed SVM in the dataset analysed. This type of methodology could help educational institutions to predict academic underachievement and thus generate strategies to improve students’ academic performance."
predicting academic success of college students using machine learning techniques,"College context and academic performance are important determinants of academic success; using students’ prior experience with machine learning techniques to predict academic success before the end of the first year reinforces college self-efficacy. Dropout prediction is related to student retention and has been studied extensively in recent work; however, there is little literature on predicting academic success using educational machine learning. For this reason, CRISP-DM methodology was applied to extract relevant knowledge and features from the data. The dataset examined consists of 6690 records and 21 variables with academic and socioeconomic information. Preprocessing techniques and classification algorithms were analyzed. The area under the curve was used to measure the effectiveness of the algorithm; XGBoost had an AUC = 87.75% and correctly classified eight out of ten cases, while the decision tree improved interpretation with ten rules in seven out of ten cases. Recognizing the gaps in the study and that on-time completion of college consolidates college self-efficacy, creating intervention and support strategies to retain students is a priority for decision makers. Assessing the fairness and discrimination of the algorithms was the main limitation of this work. In the future, we intend to apply the extracted knowledge and learn about its influence of on university management."
a point cloud dataset of vehicles passing through a toll station for use in training classification algorithms,"This work presents a point cloud dataset of vehicles passing through a toll station in Colombia to be used to train artificial vision and computational intelligence algorithms. This article details the process of creating the dataset, covering initial data acquisition, range information preprocessing, point cloud validation, and vehicle labeling. Additionally, a detailed description of the structure and content of the dataset is provided, along with some potential applications of its use. The dataset consists of 36,026 total objects divided into 6 classes: 31,432 cars, campers, vans and 2-axle trucks with a single tire on the rear axle, 452 minibuses with a single tire on the rear axle, 1158 buses, 1179 2-axle small trucks, 797 2-axle large trucks, and 1008 trucks with 3 or more axles. The point clouds were captured using a LiDAR sensor and Doppler effect speed sensors. The dataset can be used to train and evaluate algorithms for range data processing, vehicle classification, vehicle counting, and traffic flow analysis. The dataset can also be used to develop new applications for intelligent transportation systems."
ariaplbud: an aerial multi-growth stage apple flower bud dataset for agricultural object detection benchmarking,"As one of the most important topics in contemporary computer vision research, object detection has received wide attention from the precision agriculture community for diverse applications. While state-of-the-art object detection frameworks are usually evaluated against large-scale public datasets containing mostly non-agricultural objects, a specialized dataset that reflects unique properties of plants would aid researchers in investigating the utility of newly developed object detectors within agricultural contexts. This article presents AriAplBud: a close-up apple flower bud image dataset created using an unmanned aerial vehicle (UAV)-based red–green–blue (RGB) camera. AriAplBud contains 3600 images of apple flower buds at six growth stages, with 110,467 manual bounding box annotations as positive samples and 2520 additional empty orchard images containing no apple flower bud as negative samples. AriAplBud can be directly deployed for developing object detection models that accept Darknet annotation format without additional preprocessing steps, serving as a potential benchmark for future agricultural object detection research. A demonstration of developing YOLOv8-based apple flower bud detectors is also presented in this article."
spectral library of plant species from montesinho natural park in portugal,"In this work, we present and describe a spectral library (SL) with 15 vascular plant species from Montesinho Natural Park (MNP), a protected area in Northeast Portugal. We selected species from the vascular plants that are characteristic of the habitats in the MNP, based on their prevalence, and also included one invasive species: Alnus glutinosa (L.) Gaertn, Castanea sativa Mill., Cistus ladanifer L., Crataegus monogyna Jacq., Frangula alnus Mill., Fraxinus angustifolia Vahl, Quercus pyrenaica Willd., Quercus rotundifolia Lam., Trifolium repens L., Arbutus unedo L., Dactylis glomerata L., Genista falcata Brot., Cytisus multiflorus (L’Hér.) Sweet, Erica arborea L., and Acacia dealbata Link. We collected spectra (300–2500 nm) from five records per leaf and leaf side, which resulted in 538 spectra compiled in the SL. Additionally, we computed five vegetation indices from spectral data and analysed them to highlight specific characteristics and differences among the sampled species. We detail the data repository information and its organisation for a better understanding of the data and to facilitate its use. The SL structure can add valuable information about the selected plant species in MNP, contributing to conservation purposes. This plant species SL is publicly available in Zenodo platform."
"elliott state research forest timber cruise, oregon, 2015-2016","The Elliott State Research Forest comprises 33,700 ha of temperate, Douglas-fir rainforest along North America’s Pacific Coast (Oregon, United States). In 2015, naturally regenerated stands at least 92 years old covered 49% of the research area and sawtimber plantations younger than 68 years another 50%. During the winter of 2015–2016, a forest wide inventory sampled both naturally regenerated and plantation stands, recording 97,424 trees on 17,866 plots in 738 stands. The resulting dataset is atypical for the area as plot locations were not restricted to upland, commercially harvestable timber. Multiage stands and riparian areas were therefore documented along with plantations 2–61 years old and trees retained through clearcut harvests. This dataset constitutes the only open access, stand-based forest inventory currently available for a large area within the Oregon Coast Range. The dataset enables development of suites of models as well as many comparisons across stand ages and types, both at stand level and at the level of individual trees."
a benchmark data set for long-term monitoring in the elter site gesäuse-johnsbachtal,"This paper gives an overview over all currently available data sets for the European Long-term Ecosystem Research (eLTER) monitoring site Gesäuse-Johnsbachtal. The site is part of the LTSER platform Eisenwurzen in the Alps of the province of Styria, Austria. It contains both protected (National Park Gesäuse) and non-protected areas (Johnsbachtal). Although the main research focus of the eLTER monitoring site Gesäuse-Johnsbachtal is on inland surface running waters, forests and other wooded land, the eLTER whole system (WAILS) approach was followed in regard to the data selection, systematically screening all available data in regard to its suitability as eLTER’s Standard Observations (SOs). Thus, data from all system strata was included, incorporating Geosphere, Atmosphere, Hydrosphere, Biosphere and Sociosphere. In the WAILS approach these SOs are key data for a whole system approach towards long term ecosystem research. Altogether, 54 data sets have been collected for the eLTER monitoring site Gesäuse-Johnsbachtal and included in the Dynamical Ecological Information Management System – Site and Data Registry (DEIMS-SDR), which is the eLTER data platform. The presented work provides all these data sets through dedicated data repositories for FAIR use. This paper gives an overview on all compiled data sets and their main properties. Additionally, the available data are evaluated in a concluding gap analysis with regard to the needed observation data according to WAILS, followed by an outlook on how to fill these gaps."
continuous wave measurements collected in intermediate depth throughout the north sea storm season during the realdune/reflex experiments,"High-resolution wave measurements at intermediate water depth are required to improve coastal impact modeling. Specifically, such data sets are desired to calibrate and validate models, and broaden the insight on the boundary conditions that force models. Here, we present a wave data set collected in the North Sea at three stations in intermediate water depth (6–14 m) during the 2021/2022 storm season as part of the RealDune/REFLEX experiments. Continuous measurements of synchronized surface elevation, velocity and pressure were recorded at 2–4 Hz by Acoustic Doppler Profilers and an Acoustic Doppler Velocimeter for a 5-month duration. Time series were quality-controlled, directional-frequency energy spectra were calculated and common bulk parameters were derived. Measured wave conditions vary from calm to energetic with 0.1–5.0 m sea-swell wave height, 5–16 s mean wave period and W-NNW direction. Nine storms, i.e., wave height beyond 2.5 m for at least six hours, were recorded including the triple storms Dudley, Eunice and Franklin. This unique data set can be used to investigate wave transformation, wave nonlinearity and wave directionality for higher and lower frequencies (e.g., sea-swell and infragravity waves) to compare with theoretical and empirical descriptions. Furthermore, the data can serve to force, calibrate and validate models during storm conditions."
eeg and physiological signals dataset from participants during traditional and partially immersive learning experiences in humanities,"The relevance of the interaction between Humanities-enhanced learning using immersive environments and simultaneous physiological signal analysis contributes to the development of Neurohumanities and advancements in applications of Digital Humanities. The present dataset consists of recordings from 24 participants divided in two groups (12 participants in each group) engaging in simulated learning scenarios, traditional learning, and partially immersive learning experiences. Data recordings from each participant contain recordings of physiological signals and psychometric data collected from applied questionnaires. Physiological signals include electroencephalography, real-time engagement and emotion recognition calculation by a Python EEG acquisition code, head acceleration, electrodermal activity, blood volume pressure, inter-beat interval, and temperature. Before the acquisition of physiological signals, participants were asked to fill out the General Health Questionnaire and Trait Meta-Mood Scale. In between recording sessions, participants were asked to fill out Likert-scale questionnaires regarding their experience and a Self-Assessment Manikin. At the end of the recording session, participants filled out the ITC Sense of Presence Inventory questionnaire for user experience. The dataset can be used to explore differences in physiological patterns observed between different learning modalities in the Humanities."
