title,abstract
comparative analysis of the predictive performance of an ann and logistic regression for the acceptability of eco-mobility using the belgrade data set,"To solve the problem of environmental pollution caused by road traffic, alternatives to vehicles with internal combustion engines are often proposed. As such, eco-mobility microvehicles have significant potential in the fight against environmental pollution, but only on the condition that they are widely accepted and that they replace the vehicles that predominantly pollute the environment. With this in mind, this study aims to elucidate the main variables that influence the acceptability of these vehicles, using prediction models based on binary logistic regression and a multilayer artificial neural network—a multilayer perceptron (ANN). The data of a random sample obtained via an online questionnaire, answered by 503 inhabitants of Belgrade (Serbia), were used for training and testing the model. A multilayer perceptron with 9 and 7 neurons in two hidden layers, a hyperbolic tangent activation function in the hidden layer, and an identity function in the output layer performed slightly better than the binary logistic regression model. With an accuracy of 85%, a precision of 79%, a recall of 81%, and an area under the ROC curve of 0.9, the multilayer perceptron model recognized the influential variables in predicting acceptability. The results of the model indicate that a respondent’s relationship to their current environmental pollution, the frequency of their use of modes of transport such as bicycles and motorcycles, their mileage for commuting, and their personal income have the greatest influence on the acceptability of using eco-mobility vehicles."
multi-scale earthquake damaged building feature set,"Earthquake disasters are marked by their unpredictability and potential for extreme destructiveness. Accurate information on building damage, captured in post-earthquake remote sensing images, is critical for an effective post-disaster emergency response. The foundational features within these images are essential for the accurate extraction of building damage data following seismic events. Presently, the availability of publicly accessible datasets tailored specifically to earthquake-damaged buildings is limited, and existing collections of post-earthquake building damage characteristics are insufficient. To address this gap and foster research advancement in this domain, this paper introduces a new, large-scale, publicly available dataset named the Major Earthquake Damage Building Feature Set (MEDBFS). This dataset comprises image data sourced from five significant global earthquakes and captured by various optical remote sensing satellites, featuring diverse scale characteristics and multiple spatial resolutions. It includes over 7000 images of buildings pre- and post-disaster, each subjected to stringent quality control and expert validation. The images are categorized into three primary groups: intact/slightly damaged, severely damaged, and completely collapsed. This paper develops a comprehensive feature set encompassing five dimensions: spectral, texture, edge detection, building index, and temporal sequencing, resulting in 16 distinct classes of feature images. This dataset is poised to significantly enhance the capabilities for data-driven identification and analysis of earthquake-induced building damage, thereby supporting the advancement of scientific and technological efforts for emergency earthquake response."
a comprehensive data pipeline for comparing the effects of momentum on sports leagues,"Momentum has been a consistently studied aspect of sports science for decades. Among the established literature, there has, at times, been a discrepancy between conclusions. However, if momentum is indeed an actual phenomenon, it would affect all aspects of sports, from player evaluation to pre-game prediction and betting. Therefore, using momentum-based features that quantify a team’s linear trend of play, we develop a data pipeline that uses a small sample of recent games to assess teams’ quality of play and measure the predictive power of momentum-based features versus the predictive power of more traditional frequency-based features across several leagues using several machine learning techniques. More precisely, we use our pipeline to determine the differences in the predictive power of momentum-based features and standard statistical features for the National Hockey League (NHL), National Basketball Association (NBA), and five major first-division European football leagues. Our findings show little evidence that momentum has superior predictive power in the NBA. Still, we found some instances of the effects of momentum on the NHL that produced better pre-game predictors, whereas we view a similar trend in European football/soccer. Our results indicate that momentum-based features combined with frequency-based features could improve pre-game prediction models and that, in the future, momentum should be studied more from a feature/performance indicator point-of-view and less from the view of the dependence of sequential outcomes, thus attempting to distance momentum from the binary view of winning and losing."
draft genome sequence of the commercial strain rhizobium ruizarguesonis bv. viciae rcam1022,"Legume plants enter a symbiosis with soil nitrogen-fixing bacteria (rhizobia), thereby gaining access to assimilable atmospheric nitrogen. Since this symbiosis is important for agriculture, biofertilizers with effective strains of rhizobia are created for crop legumes to increase their yield and minimize the amounts of mineral fertilizers required. In this work, we sequenced and characterized the genome of Rhizobium ruizarguesonis bv. viciae strain RCAM1022, a component of the ‘Rhizotorfin’ biofertilizer produced in Russia and used for pea (Pisum sativum L.)."
experimental data on maximum swelling pressure of clayey soils and related soil properties,"Clayey soils exhibit significant volumetric changes in response to variations in water content. The swelling pressure of clayey soils is a critical parameter for evaluating the stability and performance of structures built on them, facilitating the development of appropriate design methodologies and mitigation strategies to ensure their long-term integrity and safety. We present a dataset comprising maximum swelling pressure values from 759 compacted soil samples, compiled from 16 articles published between 1994 and 2022. The dataset is classified into two main groups: 463 samples of natural clays and 296 samples of bentonite and bentonite mixtures, providing data on various types of soils and their properties. Different swelling test methods, including zero swelling, swell consolidation, restrained swell, double oedometer, free swelling, constant volume oedometer, UPC isochoric cell, isochoric oedometer and consolidometer, were employed to measure the maximum swelling pressure. The comprehensive nature of the dataset enhances its applicability for geotechnical projects. The dataset is a valuable resource for understanding the complex interactions between soil properties and swelling behavior, contributing to advancements in soil mechanics and geotechnical engineering."
training datasets for epilepsy analysis: preprocessing and feature extraction from electroencephalography time series,"We describe 20 datasets derived through signal filtering and feature extraction steps applied to the raw time series EEG data of 20 epileptic patients, as well as the methods we used to derive them. Background: Epilepsy is a complex neurological disorder which has seizures as its hallmark. Electroencephalography plays a crucial role in epilepsy assessment, offering insights into the brain’s electrical activity and advancing our understanding of seizures. The availability of tagged training sets covering all seizure phases—inter-ictal, pre-ictal, ictal, and post-ictal—is crucial for data-driven epilepsy analyses. Methods: Using the sliding window technique with a two-second window length and a one-second time slip, we extract multiple features from the preprocessed EEG time series of 20 patients from the Freiburg Seizure Prediction Database. In addition, we assign a class label to each instance to specify its corresponding seizure phase. All these operations are made through a software application we developed, which is named Training Builder. Results: The 20 tagged training datasets each contain 1080 univariate and bivariate features, and are openly and publicly available. Conclusions: The datasets support the training of data-driven models for seizure detection, prediction, and clustering, based on features engineering."
review of data processing methods used in predictive maintenance for next generation heavy machinery,"Vibration-based condition monitoring plays an important role in maintaining reliable and effective heavy machinery in various sectors. Heavy machinery involves major investments and is frequently subjected to extreme operating conditions. Therefore, prompt fault identification and preventive maintenance are important for reducing costly breakdowns and maintaining operational safety. In this review, we look at different methods of vibration data processing in the context of vibration-based condition monitoring for heavy machinery. We divided primary approaches related to vibration data processing into three categories–signal processing methods, preprocessing-based techniques and artificial intelligence-based methods. We highlight the importance of these methods in improving the reliability and effectiveness of heavy machinery condition monitoring systems, highlighting the importance of precise and automated fault detection systems. To improve machinery performance and operational efficiency, this review aims to provide information on current developments and future directions in vibration-based condition monitoring by addressing issues like imbalanced data and integrating cutting-edge techniques like anomaly detection algorithms."
natural language processing patents landscape analysis,"Understanding NLP patents provides valuable insights into innovation trends and competitive dynamics in artificial intelligence. This study uses the Lens patent database to investigate the landscape of NLP patents. The overall patent output in the NLP field on a global scale has exhibited a rapid growth over the past decade, indicating rising research and commercial interests in applying NLP techniques. By analyzing patent assignees, technology categories, and geographic distribution, we identify leading innovators as well as research hotspots in applying NLP. The patent landscape reflects intensifying competition between technology giants and research institutions. This research aims to synthesize key patterns and developments in NLP innovation revealed through patent data analysis, highlighting implications for firms and policymakers. A detailed understanding of NLP patenting activity can inform intellectual property strategy and technology investment decisions in this burgeoning AI domain."
adas simulation result dataset processing based on improved bp neural network,The autonomous driving simulation field lacks evaluation and forecasting systems for simulation results. The data obtained from the simulation of target algorithms and vehicle models cannot be reasonably estimated. This problem affects subsequent vehicle improvement and parameter calibration. The authors relied on the simulation results of the AEB algorithm. We selected the BP Neural Network as the basis and improved it with a genetic algorithm optimized via a roulette algorithm. The regression evaluation indicators of the prediction results show that the GA-BP neural network has better prediction accuracy and generalization ability than the original BP neural network and other optimized BP neural networks. This GA-BP neural network also fills the Gap in Evaluation and Prediction Systems.
"covid-19 lockdown effects on sleep, immune fitness, mood, quality of life, and academic functioning: survey data from turkish university students","Previous studies from the Netherlands, Germany, and Argentina revealed that the 2019 coronavirus disease (COVID-19) pandemic and associated lockdown periods had a significant negative impact on the wellbeing and quality of life of students. The negative impact of lockdown periods on health correlates such as immune fitness, alcohol consumption, and mood were reflected in their academic functioning. As both the duration and intensity of lockdown measures differed between countries, it is important to replicate these findings in different countries and cultures. Therefore, the purpose of the current study was to examine the impact of the COVID-19 pandemic on immune fitness, mood, academic functioning, sleep, smoking, alcohol consumption, healthy diet, and quality of life among Turkish students. Turkish students in the age range of 18 to 30 years old were invited to complete an online survey. Data were collected from n = 307 participants and included retrospective assessments for six time periods: (1) BP (before the COVID-19 pandemic, 1 January 2020–10 March 2020), (2) NL1 (the first no lockdown period, 11 March 2020–28 April 2021), (3) the lockdown period (29 April 2021–17 May 2021), (4) NL2 (the second no lockdown period, 18 May 2021–31 December 2021), (5) NL3 (the third no lockdown period, 1 January 2022–December 2022), and (6) for the past month. In this data descriptor article, the content of the survey and the dataset are described."
evaluation of online inquiry competencies of chilean elementary school students: a dataset,"In the age of abundant digital content, children and adolescents face the challenge of developing new information literacy competencies, particularly those pertaining to online inquiry, in order to thrive academically and personally. This article addresses the challenge encountered by Chilean students in developing online inquiry competencies (OICs) essential for completing school assignments, particularly in natural science education. A diagnostic study was conducted with 279 elementary school students (from fourth to eighth grade) from four educational institutions in Chile, representing diverse socioeconomic backgrounds. An instrument aligned with the national curriculum, featuring questions related to natural sciences, was administered through a game named NEURONE-Trivia, which integrates a search engine and a logging component to record students’ search behavior. The primary outcome of this study is a dataset comprising demographic information, self-perception, and information-seeking behaviors data collected during students’ online search sessions for natural science research tasks. This dataset serves as a valuable resource for researchers, educators, and practitioners interested in investigating the interplay between demographic characteristics, self-perception, and information-seeking behaviors among elementary students within the context of OIC development. Furthermore, it enables further examination of students’ search behaviors concerning source evaluation, information retrieval, and information utilization."
machine learning classification workflow and datasets for ionospheric vlf data exclusion,"Machine learning (ML) methods are commonly applied in the fields of extraterrestrial physics, space science, and plasma physics. In a prior publication, an ML classification technique, the Random Forest (RF) algorithm, was utilized to automatically identify and categorize erroneous signals, including instrument errors, noisy signals, outlier data points, and the impact of solar flares (SFs) on the ionosphere. This data communication includes the pre-processed dataset used in the aforementioned research, along with a workflow that utilizes the PyCaret library and a post-processing workflow. The code and data serve educational purposes in the interdisciplinary field of ML and ionospheric physics science, as well as being useful to other researchers for diverse objectives."
expanded brain ct dataset for the development of ai systems for intracranial hemorrhage detection and classification,"Intracranial hemorrhage (ICH) is a dangerous life-threatening condition leading to disability. Timely and high-quality diagnosis plays a huge role in the course and outcome of this disease. The gold standard in determining ICH is computed tomography. This method requires a prompt involvement of highly qualified personnel, which is not always possible, for example, in case of a staff shortage or increased workload. In such a situation, every minute counts, and time can be lost. The solution to this problem seems to be a set of diagnostic decisions, including the use of artificial intelligence, which will help to identify patients with ICH in a timely manner and provide prompt and quality medical care. However, the main obstacle to the development of artificial intelligence is a lack of high-quality datasets for training and testing. In this paper, we present a dataset including 800 brain CT scans consisting of multiple series of DICOM images with and without signs of ICH, enriched with clinical and technical parameters, as well as the methodology of its generation utilizing natural language processing tools. The dataset is publicly available, which contributes to increased competition in the development of artificial intelligence systems and their advancement and quality improvement."
leveraging sports analytics and association rule mining to uncover recovery and economic impacts in nba basketball,"This study examines the multifaceted field of injuries and their impacts on performance in the National Basketball Association (NBA), leveraging a blend of Data Science, Data Mining, and Sports Analytics. Our research is driven by three pivotal questions: Firstly, we explore how Association Rule Mining can elucidate the complex interplay between players’ salaries, physical attributes, and health conditions and their influence on team performance, including team losses and recovery times. Secondly, we investigate the relationship between players’ recovery times and their teams’ financial performance, probing interdependencies with players’ salaries and career trajectories. Lastly, we examine how insights gleaned from Data Mining and Sports Analytics on player recovery times and financial influence can inform strategic financial management and salary negotiations in basketball. Harnessing extensive datasets detailing player demographics, injuries, and contracts, we employ advanced analytic techniques to categorize injuries and transform contract data into a format conducive to deep analytical scrutiny. Our anomaly detection methodologies, an ensemble combination of DBSCAN, isolation forest, and Z-score algorithms, spotlight patterns and outliers in recovery times, unveiling the intricate dance between player health, performance, and financial outcomes. This nuanced understanding emphasizes the economic stakes of sports injuries. The findings of this study provide a rich, data-driven foundation for teams and stakeholders, advocating for more effective injury management and strategic planning. By addressing these research questions, our work not only contributes to the academic discourse in Sports Analytics but also offers practical frameworks for enhancing player welfare and team financial health, thereby shaping the future of strategic decisions in professional sports."
"dna of music: identifying relationships among different versions of the composition sadhukarn from thailand, laos, and cambodia using multivariate statistics","Sadhukarn, a sacred music composition performed ritually to salute and invite divine powers to open a ceremony or feast, is played in Thailand, Cambodia, and Laos. Different countries have unique versions, arranged based on musicians’ skills and en vogue styles. This study presents the results of multivariate statistical analyses of 26 different versions of Sadhukarn main melodies using non-metric multidimensional scaling (NMDS) and cluster analysis. The objective was to identify the optimal number of parameters for identifying the origin and relationships among Sadhukarn versions, including rhyme structures, pillar tone, rhythmic and melodic patterns, intervals, pitches, and combinations of these parameters. The data were analyzed using both full and normalized datasets (32 phrases) to avoid biases due to differences in phrases among versions. Overall, the combination of six parameters is the best approach for data analysis in both full and normalized datasets. The analysis of the ‘full version’ shows the separation of Sadhukarn versions from different countries of origin, while the analysis of the ‘normalized version’ reveals the rhyme structure, rhythmic structure, and pitch as crucial parameters for identifying Sadhukarn versions. We conclude that multivariate statistics are powerful tools for identifying relationships among different versions of Sadhukarn compositions from Thailand, Laos, and Cambodia and within the same countries of origin."
longitudinal patterns of online activity and social feedback are associated with current and perceived changes in quality of life in adult facebook users,"The present study explored how sharing verbal status updates on Facebook and receiving Likes, as a form of positive social feedback, correlate with current and perceived changes in Quality of Life (QoL). Utilizing the Facebook Graph API, we collected a longitudinal dataset comprising status updates and Likes received by 1577 adult Facebook users over a 12-month period. Two monthly indicators were calculated: the percentage of verbal status updates and the average number of Likes per post. Participants were administered a survey to assess current and perceived changes in QoL. Confirmatory Factor Analysis (CFA) and the Auto-Regressive Latent Trajectory Model with Structured Residuals (ALT-SRs) were used to model longitudinal patterns emerging from the objective recordings of Facebook activity and explore their correlation with QoL measures. Findings indicated a positive correlation between the percentage of verbal status updated on Facebook and current QoL. Online positive social feedback, measured through received Likes, was associated with both current QoL and perceived improvements in QoL. Of note, perceived improvements in QoL correlated with an increase in received Likes over time. Results highlight the relevance of collecting and modeling longitudinal Facebook data for the investigation of the association between activity on social media and individual well-being."
"detailed landslide traces database of hancheng county, china, based on high-resolution satellite images available on the google earth platform","Hancheng is located in the eastern part of China’s Shaanxi Province, near the west bank of the Yellow River. It is located at the junction of the active geological structure area. The rock layer is relatively fragmented, and landslide disasters are frequent. The occurrence of landslide disasters often causes a large number of casualties along with economic losses in the local area, seriously restricting local economic development. Although risk assessment and deformation mechanism analysis for single landslides have been performed for landslide disasters in the Hancheng area, this area lacks a landslide traces database. A complete landslide database comprises the basic data required for the study of landslide disasters and is an important requirement for subsequent landslide-related research. Therefore, this study used multi-temporal high-resolution optical images and human-computer interaction visual interpretation methods of the Google Earth platform to construct a landslide traces database in Hancheng County. The results showed that at least 6785 landslides had occurred in the study area. The total area of the landslides was about 95.38 km2, accounting for 5.88% of the study area. The average landslide area was 1406.04 m2, the largest landslide area was 377,841 m2, and the smallest landslide area was 202.96 m2. The results of this study provides an important basis for understanding the spatial distribution of landslides in Hancheng County, the evaluation of landslide susceptibility, and local disaster prevention and mitigation work."
pupil data upon stimulation by auditory stimuli,"Evaluating hearing in newborns and uncooperative patients can pose a considerable challenge. One potential solution might be to employ the Pupil Dilation Response (PDR) as an objective physiological metric. In this dataset descriptor paper, we present a collection of data showing changes in pupil dimension and shape upon presentation of auditory stimuli. In particular, we collected pupil data from 16 subjects, with no known hearing loss, upon different lighting conditions, measured in response to a series of 60–100 audible tones, all of the same frequency and amplitude, which may serve to further investigate any relationship between hearing capabilities and PDRs."
