title,abstract
adaptive forecasting in energy consumption: a bibliometric analysis and review,"This paper addresses the challenges in forecasting electrical energy in the current era of renewable energy integration. It reviews advanced adaptive forecasting methodologies while also analyzing the evolution of research in this field through bibliometric analysis. The review highlights the key contributions and limitations of current models with an emphasis on the challenges of traditional methods. The analysis reveals that Long Short-Term Memory (LSTM) networks, optimization techniques, and deep learning have the potential to model the dynamic nature of energy consumption, but they also have higher computational demands and data requirements. This review aims to offer a balanced view of current advancements and challenges in forecasting methods, guiding researchers, policymakers, and industry experts. It advocates for collaborative innovation in adaptive methodologies to enhance forecasting accuracy and support the development of resilient, sustainable energy systems."
effective and robust adversarial training against data and label corruptions,"Corruptions due to data perturbations and label noise are prevalent in the datasets from unreliable sources, which poses significant threats to model training. Despite existing efforts in developing robust models, current learning methods commonly overlook the possible co-existence of both corruptions, limiting the effectiveness and practicability of the model. In this paper, we develop an Effective and Robust Adversarial Training (ERAT) framework to simultaneously handle two types of corruption (i.e., data and label) without prior knowledge of their specifics. We propose a hybrid adversarial training surrounding multiple potential adversarial perturbations, alongside a semi-supervised learning based on class-rebalancing sample selection to enhance the resilience of the model for dual corruption. On the one hand, in the proposed adversarial training, the perturbation generation module learns multiple surrogate malicious data perturbations by taking a DNN model as the victim, while the model is trained to maintain semantic consistency between the original data and the hybrid perturbed data. It is expected to enable the model to cope with unpredictable perturbations in real-world data corruption. On the other hand, a class-rebalancing data selection strategy is designed to fairly differentiate clean labels from noisy labels. Semi-supervised learning is performed accordingly by discarding noisy labels. Extensive experiments demonstrate the superiority of the proposed ERAT framework."
adaptive global-local representation learning and selection for cross-domain facial expression recognition,"Domain shift poses a significant challenge in Cross-Domain Facial Expression Recognition (CD-FER) due to the distribution variation between the source and target domains. Current algorithms mainly focus on learning domain-invariant features through global feature adaptation, while neglecting the transferability of local features across different domains. Additionally, these algorithms lack discriminative supervision during training on target datasets, resulting in deteriorated feature representation in the target domain. To address these limitations, we propose an Adaptive Global-Local Representation Learning and Selection (AGLRLS) framework. The framework incorporates global-local adversarial adaptation and semantic-aware pseudo label generation to enhance the learning of domain-invariant and discriminative feature representation during training. Meanwhile, a global-local prediction consistency learning is introduced to improve classification results during inference. Specifically, the framework consists of separate global-local adversarial learning modules that learn domain-invariant global and local features independently. We also design a semantic-aware pseudo label generation module, which computes semantic labels based on global and local features. Moreover, a novel dynamic threshold strategy is employed to learn the optimal thresholds by leveraging independent prediction of global and local features, ensuring filtering out the unreliable pseudo labels while retaining reliable ones. These labels are utilized for model optimization through the adversarial learning process in an end-to-end manner. During inference, a global-local prediction consistency module is developed to automatically learn an optimal result from multiple predictions. To validate the effectiveness of our framework, we conduct comprehensive experiments and analysis based on a fair evaluation benchmark. The results demonstrate that the proposed framework outperforms the current competing methods by a substantial margin."
manifold-based incomplete multi-view clustering via bi-consistency guidance,"Incomplete multi-view clustering primarily focuses on dividing unlabeled data into corresponding categories with missing instances, and has received intensive attention due to its superiority in real applications. Considering the influence of incomplete data, the existing methods mostly attempt to recover data by adding extra terms. However, for the unsupervised methods, a simple recovery strategy will cause errors and outlying value accumulations, which will affect the performance of the methods. Broadly, the previous methods have not taken the effectiveness of recovered instances into consideration, or cannot flexibly balance the discrepancies between recovered data and original data. To address these problems, we propose a novel method termed Manifold-based Incomplete Multi-view clustering via Bi-consistency guidance (MIMB), which flexibly recovers incomplete data among various views, and attempts to achieve biconsistency guidance via reverse regularization. In particular, MIMB adds reconstruction terms to representation learning by recovering missing instances, which dynamically examines the latent consensus representation. Moreover, to preserve the consistency information among multiple views, MIMB implements a biconsistency guidance strategy with reverse regularization of the consensus representation and proposes a manifold embedding measure for exploring the hidden structure of the recovered data. Notably, MIMB aims to balance the importance of different views, and introduces an adaptive weight term for each view. Finally, an optimization algorithm with an alternating iteration optimization strategy is designed for final clustering. Extensive experimental results on 6 benchmark datasets are provided to confirm that MIMB can significantly obtain superior results as compared with several state-of-the-art baselines."
hint: high-quality inpainting transformer with mask-aware encoding and enhanced attention,"Existing image inpainting methods leverage convolution-based downsampling approaches to reduce spatial dimensions. This may result in information loss from corrupted images where the available information is inherently sparse, especially for the scenario of large missing regions. Recent advances in self-attention mechanisms within transformers have led to significant improvements in many computer vision tasks including inpainting. However, limited by the computational costs, existing methods cannot fully exploit the efficacy of long-range modelling capabilities of such models. In this paper, we propose an end-to-end High-quality INpainting Transformer, abbreviated as HINT, which consists of a novel mask-aware pixel-shuffle downsampling module (MPD) to preserve the visible information extracted from the corrupted image while maintaining the integrity of the information available for high-level inferences made within the model. Moreover, we propose a Spatially-activated Channel Attention Layer (SCAL), an efficient self-attention mechanism interpreting spatial awareness to model the corrupted image at multiple scales. To further enhance the effectiveness of SCAL, motivated by recent advanced in speech recognition, we introduce a sandwich structure that places feed-forward networks before and after the SCAL module. We demonstrate the superior performance of HINT compared to contemporary state-of-the-art models on four datasets, CelebA, CelebA-HQ, Places2, and Dunhuang."
multi-level label correction by distilling proximate patterns for semi-supervised semantic segmentation,"Semi-supervised semantic segmentation relieves the reliance on large-scale labeled data by leveraging unlabeled data. Recent semi-supervised semantic segmentation approaches mainly resort to pseudo-labeling methods to exploit unlabeled data. However, unreliable pseudo-labeling can undermine the semi-supervision processes. In this paper, we propose an algorithm called Multi-Level Label Correction (MLLC), which aims to use graph neural networks to capture structural relationships in Semantic-Level Graphs (SLGs) and Class-Level Graphs (CLGs) to rectify erroneous pseudo-labels. Specifically, SLGs represent semantic affinities between pairs of pixel features, and CLGs describe classification consistencies between pairs of pixel labels. With the support of proximate pattern information from graphs, MLLC can rectify incorrectly predicted pseudo-labels and can facilitate discriminative feature representations. We design an end-to-end network to train and perform this effective label corrections mechanism. Experiments demonstrate that MLLC can significantly improve supervised baselines and outperforms state-of-the-art approaches in different scenarios on Cityscapes and PASCAL VOC 2012 datasets. Specifically, MLLC improves the supervised baseline by at least 5% and 2% with DeepLabV2 and DeepLabV3+ respectively under different partition protocols."
lightweight model pre-training via language guided knowledge distillation,"This paper studies the problem of pre-training for small models, which is essential for many mobile devices. Current state-of-the-art methods on this problem transfer the representational knowledge of a large network (as a Teacher) into a smaller model (as a Student) using self-supervised distillation, improving the performance of the small model on downstream tasks. However, existing approaches are insufficient in extracting the crucial knowledge that is useful for discerning categories in downstream tasks during the distillation process. In this paper, for the first time, we introduce language guidance to the distillation process and propose a new method named Language-Guided Distillation (LGD) system, which uses category names of the target downstream task to help refine the knowledge transferred between the teacher and student. To this end, we utilize a pre-trained text encoder to extract semantic embeddings from language and construct a textual semantic space called Textual Semantics Bank (TSB). Furthermore, we design a Language-Guided Knowledge Aggregation (LGKA) module to construct the visual semantic space, also named Visual Semantics Bank (VSB). The task-related knowledge is transferred by driving a student encoder to mimic the similarity score distribution inferred by a teacher over TSB and VSB. Compared with other small models obtained by either ImageNet pre-training or self-supervised distillation, experiment results show that the distilled lightweight model using the proposed LGD method presents state-of-the-art performance and is validated on various downstream tasks, including classification, detection, and segmentation. We have made the code available at https://github.com/mZhenz/LGD."
opinion-unaware blind image quality assessment using multi-scale deep feature statistics,"Deep learning-based methods have significantly influenced the blind image quality assessment (BIQA) field, however, these methods often require training using large amounts of human rating data. In contrast, traditional knowledge-based methods are cost-effective for training but face challenges in effectively extracting features aligned with human visual perception. To bridge these gaps, we propose integrating deep features from pre-trained visual models with a statistical analysis model into a Multi-scale Deep Feature Statistics (MDFS) model for achieving opinion-unaware BIQA (OU-BIQA), thereby eliminating the reliance on human rating data and significantly improving training efficiency. Specifically, we extract patch-wise multi-scale features from pre-trained vision models, which are subsequently fitted into a multivariate Gaussian (MVG) model. The final quality score is determined by quantifying the distance between the MVG model derived from the test image and the benchmark MVG model derived from the high-quality image set. A comprehensive series of experiments conducted on various datasets show that our proposed model exhibits superior consistency with human visual perception compared to state-of-the-art BIQA models. Furthermore, it shows improved generalizability across diverse target-specific BIQA tasks. Our code is available at: https://github.com/eezkni/MDFS"
predicting visual attention in graphic design documents,"We present a model for predicting visual attention during the free viewing of graphic design documents. While existing works on this topic have aimed at predicting static saliency of graphic designs, our work is the first attempt to predict both spatial attention and dynamic temporal order in which the document regions are fixated by gaze using a deep learning based model. We propose a two-stage model for predicting dynamic attention on such documents, with webpages being our primary choice of document design for demonstration. In the first stage, we predict the saliency maps for each of the document components (e.g. logos, banners, texts, etc. for webpages) conditioned on the type of document layout. These component saliency maps are then jointly used to predict the overall document saliency. In the second stage, we use these layout-specific component saliency maps as the state representation for an inverse reinforcement learning model of fixation scanpath prediction during document viewing. To test our model, we collected a new dataset consisting of eye movements from 41 people freely viewing 450 webpages (the largest dataset of its kind). Experimental results show that our model outperforms existing models in both saliency and scanpath prediction for webpages, and also generalizes very well to other graphic design documents such as comics, posters, mobile UIs, etc. and natural images."
frequency-based matcher for long-tailed semantic segmentation,"The successful application of semantic segmentation technology in the real world has been among the most exciting achievements in the computer vision community over the past decade. Although the long-tailed phenomenon has been investigated in many fields, e.g., classification and object detection, it has not received enough attention in semantic segmentation and has become a non-negligible obstacle to applying semantic segmentation technology in autonomous driving and virtual reality. Therefore, in this work, we focus on a relatively under-explored task setting, long-tailed semantic segmentation (LTSS). We first establish three representative datasets from different aspects, i.e., scene, object, and human. We further propose a dual-metric evaluation system and construct the LTSS benchmark to demonstrate the performance of semantic segmentation methods and long-tailed solutions. We also propose a transformer-based algorithm to improve LTSS, frequency-based matcher, which solves the oversuppression problem by one-to-many matching and automatically determines the number of matching queries for each class. Given the comprehensiveness of this work and the importance of the issues revealed, this work aims to promote the empirical study of semantic segmentation tasks. Our datasets, codes, and models will be publicly available."
pointgl: a simple global-local framework for efficient point cloud analysis,"Efficient analysis of point clouds holds paramount significance in real-world 3D applications. Currently, prevailing point-based models adhere to the PointNet++ methodology, which involves embedding and abstracting point features within a sequence of spatially overlapping local point sets, resulting in noticeable computational redundancy. Drawing inspiration from the streamlined paradigm of pixel embedding followed by regional pooling in Convolutional Neural Networks (CNNs), we introduce a novel, uncomplicated yet potent architecture known as PointGL, crafted to facilitate efficient point cloud analysis. PointGL employs a hierarchical process of feature acquisition through two recursive steps. First, the <italic>Global Point Embedding</italic> leverages straightforward residual Multilayer Perceptrons (MLPs) to effectuate feature embedding for each individual point. Second, the novel <italic>Local Graph Pooling</italic> technique characterizes point-to-point relationships and abstracts regional representations through succinct local graphs. The harmonious fusion of one-time point embedding and parameter-free graph pooling contributes to PointGL's defining attributes of minimized model complexity and heightened efficiency. Our PointGL attains state-of-the-art accuracy on the ScanObjectNN dataset while exhibiting a runtime that is more than <inline-formula><tex-math notation= LaTeX >$\bm {5}$</tex-math></inline-formula> times faster and utilizing only approximately <inline-formula><tex-math notation= LaTeX >$\bm {4\%}$</tex-math></inline-formula> of the FLOPs and <inline-formula><tex-math notation= LaTeX >$\bm {30\%}$</tex-math></inline-formula> of the parameters compared to the recent PointMLP model."
from canteen food to daily meals: generalizing food recognition to more practical scenarios,"The precise recognition of food categories plays a pivotal role for intelligent health management, attracting significant research attention in recent years. Prominent benchmarks, such as Food-101 and VIREO Food-172, provide abundant food image resources that catalyze the prosperity of research in this field. Nevertheless, these datasets are well-curated from canteen scenarios and thus deviate from food appearances in daily life. This discrepancy poses great challenges in effectively transferring classifiers trained on these canteen datasets to broader daily-life scenarios encountered by humans. Toward this end, we present two new benchmarks, namely DailyFood-172 and DailyFood-16, specifically designed to curate food images from everyday meals. These two datasets are used to evaluate the transferability of approaches from the well-curated food image domain to the everyday-life food image domain. In addition, we also propose a simple yet effective baseline method named Multi-Cluster Reference Learning (MCRL) to tackle the aforementioned domain gap. MCRL is motivated by the observation that food images in daily-life scenarios exhibit greater intra-class appearance variance compared with those in well-curated benchmarks. Notably, MCRL can be seamlessly coupled with existing approaches, yielding non-trivial performance enhancements. We hope our new benchmarks can inspire the community to explore the transferability of food recognition models trained on well-curated datasets toward practical real-life applications."
context-aware interaction network for rgb-t semantic segmentation,"RGB-T semantic segmentation is a key technique for autonomous driving scenes understanding. For the existing RGB-T semantic segmentation methods, however, the effective exploration of the complementary relationship between different modalities is not implemented in the information interaction between multiple levels. To address such an issue, the Context-Aware Interaction Network (CAINet) is proposed for RGB-T semantic segmentation, which constructs interaction space to exploit auxiliary tasks and global context for explicitly guided learning. Specifically, we propose a Context-Aware Complementary Reasoning (CACR) module aimed at establishing the complementary relationship between multimodal features with the long-term context in both spatial and channel dimensions. Further, considering the importance of global contextual and detailed information, we propose the Global Context Modeling (GCM) module and Detail Aggregation (DA) module, and we introduce specific auxiliary supervision to explicitly guide the context interaction and refine the segmentation map. Extensive experiments on two benchmark datasets of MFNet and PST900 demonstrate that the proposed CAINet achieves state-of-the-art performance."
learning with imbalanced noisy data by preventing bias in sample selection,"Learning with noisy labels has gained increasing attention because the inevitable imperfect labels in real-world scenarios can substantially hurt the deep model performance. Recent studies tend to regard low-loss samples as clean ones and discard high-loss ones to alleviate the negative impact of noisy labels. However, real-world datasets contain not only noisy labels but also class imbalance. The imbalance issue is prone to causing failure in the loss-based sample selection since the under-learning of tail classes also leans to produce high losses. To this end, we propose a simple yet effective method to address noisy labels in imbalanced datasets. Specifically, we propose Class-Balance-based sample Selection (CBS) to prevent the tail class samples from being neglected during training. We propose Confidence-based Sample Augmentation (CSA) for the chosen clean samples to enhance their reliability in the training process. To exploit selected noisy samples, we resort to prediction history to rectify labels of noisy samples. Moreover, we introduce the Average Confidence Margin (ACM) metric to measure the quality of corrected labels by leveraging the model's evolving training dynamics, thereby ensuring that low-quality corrected noisy samples are appropriately masked out. Lastly, consistency regularization is imposed on filtered label-corrected noisy samples to boost model performance. Comprehensive experimental results on synthetic and real-world datasets demonstrate the effectiveness and superiority of our proposed method, especially in imbalanced scenarios."
lightweight adaptive feature de-drifting for compressed image classification,"JPEG is a widely used compression scheme to efficiently reduce the volume of the transmitted images at the expense of visual perception drop. The artifacts appear among blocks due to the information loss in the compression process, which not only affects the quality of images but also harms the subsequent high-level tasks in terms of feature drifting. High-level vision models trained on high-quality images will suffer performance degradation when dealing with compressed images, especially on mobile devices. In recent years, numerous learning-based JPEG artifacts removal methods have been proposed to handle visual artifacts. However, it is not an ideal choice to use these JPEG artifacts removal methods as a pre-processing for compressed image classification for the following reasons: 1) These methods are designed for human vision rather than high-level vision models. 2) These methods are not efficient enough to serve as a pre-processing on resource-constrained devices. To address these issues, this paper proposes a novel lightweight adaptive feature de-drifting module (AFD-Module) to boost the performance of pre-trained image classification models when facing compressed images. First, a Feature Drifting Estimation Network (FDE-Net) is devised to generate the spatial-wise Feature Drifting Map (FDM) in the DCT domain. Next, the estimated FDM is transmitted to the Feature Enhancement Network (FE-Net) to generate the mapping relationship between degraded features and corresponding high-quality features. Specially, a simple but effective RepConv block equipped with structural re-parameterization is utilized in FE-Net, which enriches feature representation in the training phase while keeping efficiency in the deployment phase. After training on limited compressed images, the AFD-Module can serve as a “plug-and-play” module for pre-trained classification models to improve their performance on compressed images. Experiments on images compressed once (i.e. ImageNet-C) and multiple times demonstrate that our proposed AFD-Module can comprehensively improve the accuracy of the pre-trained classification models and significantly outperform the existing methods."
